keyword,description,category,datatype,comment,hdu,missions,mandatory,content,relevance_score,relevance_comment,user_comment
VISITSTA,"Status of the visit (e.g., SUCCESSFUL, DATALOSS)",Visit,string,Status of a visit,PRIMARY,JWST,False,"This keyword indicates the overall outcome or status of the observation visit, such as 'SUCCESSFUL,' 'DATALOSS,' or 'FAILED.' It's critical for users to quickly assess the quality and usability of the data.",95,"This provides critical information about the success and quality of the observation, highly relevant for data assessment.",
NEXPOSUR,Total number of planned exposures in the visit,Visit,integer,Total number of planned exposures in visit,PRIMARY,JWST,False,This keyword specifies the total number of individual exposures that were planned to be taken during this entire observation visit. It provides context for the complete dataset and helps verify if all expected data frames were acquired.,75,This provides useful context about the scope of the observation and data completeness.,
INTARGET,At least one exposure in the visit is internally targeted,Visit,boolean,At least one exposure in visit is internal,PRIMARY,JWST,False,"This boolean keyword indicates whether at least one exposure within the observation visit was designated as an 'internal target,' typically meaning it's pointed at an internal calibration source rather than an external astronomical object. It helps differentiate between science and calibration data.",78,This helps users understand if the data pertains to an astronomical target or an internal calibration.,
TARGOOPP,Visit scheduled as a target of opportunity,Visit,boolean,Visit scheduled as target of opportunity,PRIMARY,JWST,False,"This boolean keyword indicates whether the observation visit was scheduled as a 'Target of Opportunity' (ToO), meaning it was triggered by a transient event like a supernova or gamma-ray burst. It provides critical context about the transient nature of the observed phenomenon.",90,"This provides essential context about the nature of the observation, indicating if it was triggered by a transient event.",
TSOVISIT,Visit uses Time Series Observation special requirement,Visit,boolean,Timer Series Observation visit indicator,PRIMARY,JWST,False,"This boolean keyword indicates if the observation was part of a Time Series Observation (TSO) program. TSOs are designed to capture changes over time, often for exoplanet transits or stellar variability studies, making this crucial for understanding the data's scientific purpose and appropriate analysis techniques.",75,It informs users about a specific observing mode that significantly impacts scientific interpretation and data analysis strategies.,
EXP_ONLY,Exposure taken through special commanding without SI configuration,Visit,boolean,Special commanding without SI configuration,PRIMARY,JWST,False,"This keyword indicates if the exposure was taken using special commanding, bypassing the standard Science Instrument (SI) configuration process. This typically signifies an engineering or diagnostic exposure, rather than a scientific observation intended for public release and analysis.",25,"This keyword primarily identifies non-standard or engineering exposures, which are rarely relevant for typical end-user scientific analysis.",
CROWDFLD,FGSes operating in a crowded star field,Visit,boolean,Are the FGSes in a crowded field?,PRIMARY,JWST,False,"This boolean keyword indicates whether the Fine Guidance Sensors (FGSes) encountered a crowded star field during the observation. Operating in a crowded field can potentially affect the accuracy and stability of guide star acquisition and tracking, which might subtly influence the overall pointing stability and astrometric quality of the data.",45,"This offers insight into potential pointing stability challenges, which can be useful for advanced users assessing data quality.",
GS_ORDER,Index of guide star within the list of selected guide stars,Guide Star,integer,guide star index within selected guide star list,PRIMARY,JWST,False,This integer specifies the index or sequential order of the particular guide star within a list of selected guide stars for an observation. It is an internal identifier used to distinguish between multiple guide stars that might have been considered or used.,20,"This is an internal identifier for guide star selection, not generally relevant for typical scientific data analysis by end-users.",
GSSTRTTM,UTC time when guide star activity started,Guide Star,string,UTC time when guide star activity started,PRIMARY,JWST,False,This keyword records the Coordinated Universal Time (UTC) when the guide star acquisition or tracking activity commenced for the observation. It provides a precise timestamp for when the telescope began actively using the guide star for fine pointing.,55,"Provides a precise timestamp for the start of guiding activity, which can be useful for detailed timing analysis or correlating with other events.",
GSENDTIM,UTC time when guide star activity completed,Guide Star,string,UTC time when guide star activity completed,PRIMARY,JWST,False,"This keyword records the Coordinated Universal Time (UTC) when the guide star acquisition or tracking activity concluded. Paired with GSSTRTTM, it defines the full duration during which the guide star was actively used to stabilize the telescope's pointing.",55,"Provides a precise timestamp for the end of guiding activity, useful for detailed timing analysis or assessing guiding duration.",
GDSTARID,"Guide Star Catalog 2 identifier (10 character, base-36)",Guide Star,string,guide star identifier,PRIMARY,JWST,False,"This keyword provides the unique 10-character, base-36 identifier for the specific guide star used from the Guide Star Catalog 2 (GSC2). This ID allows researchers to look up detailed properties of the guide star in star catalogs.",60,"This identifies the specific guide star used, allowing advanced users to look up its properties for detailed analysis or verification.",
GS_RA,ICRS right ascension of the guide star (degrees),Guide Star,float,guide star right ascension,PRIMARY,JWST,False,"This keyword specifies the ICRS (International Celestial Reference System) Right Ascension coordinate of the guide star, measured in degrees. It is a fundamental celestial coordinate defining the guide star's position on the sky, crucial for understanding the telescope's pointing context.",80,"Provides the precise celestial Right Ascension of the guide star, which is crucial for understanding pointing context and verifying astrometry.",
GS_DEC,ICRS declination of the guide star (degrees),Guide Star,float,guide star declination,PRIMARY,JWST,False,"This keyword specifies the ICRS (International Celestial Reference System) Declination coordinate of the guide star, measured in degrees. Along with GS_RA, it precisely defines the guide star's position on the sky and is essential for astrometric analyses.",80,"Provides the precise celestial Declination of the guide star, crucial for understanding pointing context and verifying astrometry.",
GS_URA,ICRS right ascension uncertainty of the guide star (arcsec),Guide Star,float,guide star right ascension uncertainty,PRIMARY,JWST,False,"This keyword provides the uncertainty in the Right Ascension (RA) measurement of the guide star, expressed in arcseconds. This value indicates the precision of the guide star's known position, which directly impacts the overall astrometric accuracy and pointing stability of the observation.",65,This provides a crucial metric for advanced users to assess the precision of the guide star's Right Ascension and its potential impact on pointing accuracy.,
GS_UDEC,ICRS declination uncertainty of the guide star (arcsec),Guide Star,float,guide star declination uncertainty,PRIMARY,JWST,False,"This keyword indicates the uncertainty in the celestial declination of the guide star used to keep the telescope pointed accurately. It tells astronomers how precisely the guide star's vertical position is known, which impacts the overall pointing stability and accuracy of the observation.",45,"This guide star uncertainty is mainly relevant for advanced users diagnosing pointing issues, not for general data consumption.",
GS_MAG,Guide star magnitude in FGS detector,Guide Star,float,guide star magnitude,PRIMARY,JWST,False,This keyword specifies the magnitude (brightness) of the guide star as measured by the Fine Guidance Sensor (FGS) detector. The guide star's brightness is crucial for assessing the reliability of the pointing system and for understanding the signal-to-noise ratio of the guiding process.,75,Knowing the guide star's brightness helps users assess observation quality and potential pointing stability.,
GS_UMAG,Guide star magnitude uncertainty,Guide Star,float,guide star magnitude uncertainty,PRIMARY,JWST,False,"This keyword represents the uncertainty in the measured magnitude of the guide star. It quantifies how precisely the guide star's brightness is known, which can be relevant for understanding the reliability of the guiding process and any potential issues.",40,"This guide star magnitude uncertainty is mainly relevant for advanced users diagnosing pointing issues, not for general data consumption.",
GS_V3_PA,V3 position angle of the guide star at the guide star location (degrees),Guide Star,float,[deg] guide star V3 Position Angle for science,PRIMARY,JWST,False,"This keyword gives the position angle of the guide star with respect to the V3 axis of the telescope, measured in degrees. It helps describe the precise orientation of the guide star relative to the instrument's field of view, which can be important for understanding roll stability and field rotation.",55,"This keyword provides specific technical details about guide star orientation, useful for advanced pointing analysis but less for general users.",
PCS_MODE,"Pointing Control System mode (FINEGUIDE, COARSE, TRACK, MOVING, NONE)",Guide Star,string,Pointing Control System mode,PRIMARY,JWST,False,"This keyword describes the mode in which the Pointing Control System (PCS) was operating during the observation. Examples include 'FINEGUIDE' for precise pointing using a guide star, or 'TRACK' for tracking a moving target. This information is vital for understanding the pointing stability and quality of the observation.",85,Knowing the pointing mode is crucial for understanding the stability and quality of the observation.,
VISITEND,UTC time when the visit ended,Guide Star,string,UTC time when the visit ended,PRIMARY,JWST,False,"This keyword records the Coordinated Universal Time (UTC) when a specific astronomical visit, or observation block, concluded. It helps track the overall timeline of observations and can be used for scheduling or correlating with other events.",90,The end time of an observation visit is important for understanding the overall observation timeline and context.,
BARTDELT,Calculated barycentric time correction from UTC (seconds),Time,float,[s] Barycentric correction at exposure start,PRIMARY,JWST,False,"This keyword provides the calculated time difference (in seconds) that must be added to the UTC timestamp to correct it to the barycentric frame of reference. This correction accounts for the Earth's motion around the Sun, ensuring accurate timing for phenomena like exoplanet transits or pulsars.",75,"This barycentric time correction is essential for precise timing analysis, making it highly relevant for researchers in time-domain astronomy.",
BSTRTIME,Barycentric-corrected exposure start time (MJD),Time,float,[d] Barycentric exposure start time in MJD,PRIMARY,JWST,False,"This keyword gives the starting time of the observation exposure, corrected to the barycenter of the Solar System and expressed as a Modified Julian Date (MJD). Using barycentric time ensures that timing measurements are consistent regardless of the Earth's position.",80,"The barycentric-corrected start time is critical for precise time-domain analysis, making it very important for advanced users and researchers.",
BENDTIME,Barycentric-corrected exposure end time (MJD),Time,float,[d] Barycentric exposure end time in MJD,PRIMARY,JWST,False,"This keyword records the ending time of the observation exposure, corrected to the barycenter of the Solar System and expressed as a Modified Julian Date (MJD). This provides a precise, astronomically relevant timestamp for the conclusion of data collection.",80,"The barycentric-corrected end time is critical for precise time-domain analysis, making it very important for advanced users and researchers.",
BMIDTIME,Barycentric-corrected exposure mid time (MJD),Time,float,[d] Barycentric exposure mid time in MJD,PRIMARY,JWST,False,"This keyword specifies the mid-point time of the observation exposure, corrected to the barycenter of the Solar System and expressed as a Modified Julian Date (MJD). The mid-exposure time is often the most representative timestamp for an observation, especially when observing variable phenomena.",85,The barycentric-corrected mid-exposure time is crucial for precise time-domain analysis and often the most representative timestamp for an observation.,
HELIDELT,Calculated heliocentric time correction from UTC (seconds),Time,float,[s] Heliocentric correction at exposure start,PRIMARY,JWST,False,"This keyword indicates the time difference, in seconds, between the observation time in UTC and the equivalent time if the observation were made from the Sun's center (heliocentric). This correction accounts for the telescope's motion around the Sun, which is vital for high-precision timing studies of variable sources.",65,"Useful for advanced timing analyses requiring heliocentric correction, but less critical for general data viewing or basic analysis.",
HSTRTIME,Heliocentric exposure start time (MJD),Time,float,[d] Heliocentric exposure start time in MJD,PRIMARY,JWST,False,"This keyword specifies the starting time of the observation in the heliocentric reference frame, expressed as a Modified Julian Date (MJD). It provides the precise beginning of data acquisition as if observed from the Sun's center, which is important for accurate timing studies across different datasets and observatories.",75,"Important for precise timing analysis, offering a standardized start time in a heliocentric frame.",
HENDTIME,Heliocentric exposure end time (MJD),Time,float,[d] Heliocentric exposure end time in MJD,PRIMARY,JWST,False,"This keyword indicates the ending time of the observation in the heliocentric reference frame, expressed as a Modified Julian Date (MJD). It marks the precise conclusion of data acquisition as if observed from the Sun's center, complementing HSTRTIME for accurate duration and timing analyses.",75,"Important for precise timing analysis, offering a standardized end time in a heliocentric frame.",
HMIDTIME,Heliocentric exposure mid time (MJD),Time,float,[d] Heliocentric exposure mid time in MJD,PRIMARY,JWST,False,"This keyword gives the midpoint time of the observation in the heliocentric reference frame, expressed as a Modified Julian Date (MJD). It represents the effective central time of the exposure as if observed from the Sun's center, often used as the primary timestamp for scientific measurements that assume a single observation time.",80,"Highly useful for associating scientific measurements with a single, precise, and standardized observation time.",
ASNPOOL,Name of the association pool file used as pipeline input,Association,string,Name of the Association Pool,PRIMARY,JWST; HST,False,This keyword stores the name of the association pool file used as input for the data processing pipeline. An association pool defines how related raw data (like multiple exposures of the same target) are grouped for combined processing into higher-level scientific products.,30,"Primarily relevant for understanding pipeline provenance and debugging, rather than direct scientific interpretation by end-users.",
ASNTABLE,Name of the association table from which this product was created,Association,string,Name of the Association Generator Table,PRIMARY,JWST; HST,False,This keyword provides the name of the association table from which the current data product was created by the pipeline. The association table details the specific rules and groupings used to combine raw exposures into the final scientific product.,35,Useful for tracking the data's pipeline processing and how individual files were grouped into a product.,
BKGLEVEL,Overall background signal level computed by the skymatch pipeline step,Background,float,Computed constant background level,PRIMARY,JWST,False,"This keyword specifies the overall background signal level, typically in data units per pixel, computed during the 'skymatch' pipeline step. This value represents the general diffuse emission or instrumental noise present across the image or spectrum.",75,"Provides crucial information about the estimated background noise, which is important for evaluating data quality and signal-to-noise.",
BKGSUB,Background signal from BKGLEVEL has been subtracted (T or F),Background,boolean,Constant background subtracted from data?,PRIMARY,JWST,False,"This boolean keyword indicates whether the background signal, as identified by BKGLEVEL, has been subtracted from the data ('T' for True, 'F' for False). It is essential for understanding the processing state and interpreting the pixel values of the image or spectrum.",90,"Essential for knowing if the data has been debiased by background subtraction, fundamentally impacting data interpretation.",
MASTERBG,Name of the 1-D master background spectrum file used in pipeline,Background,string,Master background file used,PRIMARY,JWST,False,This keyword stores the name of the 1-D master background spectrum file utilized by the pipeline during processing. Master background files are pre-calibrated reference files used to remove diffuse emission or instrumental noise from scientific observations.,45,Primarily useful for advanced users or pipeline developers who need to understand the exact reference files used for background subtraction.,
FILENAME,Name of the file,Calibration,string,Name of the file,PRIMARY,JWST; HST,False,"This keyword simply stores the name of the FITS file itself. While seemingly redundant, it can be useful for internal tracking within data pipelines or for verifying data integrity if files are renamed or moved.",20,"While fundamental, the filename is usually known to the user who opened the file, making its header presence redundant for most end-user applications.",
FILETYPE,"Type of data in the file (e.g., SCIENCE, CALIBRATION)",Calibration,string,Type of data in the file,PRIMARY,JWST; HST,False,"This keyword indicates the general category or purpose of the data stored in the FITS file, such as 'SCIENCE' for observation data or 'CALIBRATION' for reference files. Knowing the file type helps users quickly understand what kind of data they are looking at and its intended use.",85,This is highly relevant as it immediately informs the user about the fundamental nature of the file's content.,
ROOTNAME,Root name of the observation set,Calibration,string,Root name of the observation set,PRIMARY,HST,False,"The root name serves as a unique identifier for a specific observation or dataset, often linking together multiple associated files (e.g., raw data, calibrated images, and derived products). It is crucial for organizing and tracking all components belonging to a single astronomical observation program.",75,This keyword is very useful for users to group and manage related files from a common observation set.,
IMAGETYP,"Type of exposure identifier (e.g., BIAS, DARK, FLAT, OBJECT)",Calibration,string,Type of exposure identifier,PRIMARY,FITS Standard; Pan-STARRS,False,"This keyword specifies the type of astronomical exposure, such as 'OBJECT' for a science observation, 'BIAS' for a zero-exposure frame, 'DARK' for a long-exposure with no light, or 'FLAT' for a uniform illumination frame. It is fundamental for understanding the purpose of an image and its role in the data calibration process.",95,"This is an essential keyword for all users, as it dictates how an image should be interpreted and whether it's science data or a calibration aid.",
LINENUM,Proposal log-sheet line number,Calibration,string,Proposal log-sheet line number,PRIMARY,HST,False,This keyword refers to an administrative line number from the original telescope proposal's log sheet. It is primarily used internally by observatories for tracking observations during scheduling and execution.,15,This is a purely administrative identifier with very little direct relevance for most end-users of an astronomy app.,
POSTARG1,POSTARG in axis 1 direction (sub-aperture offset),Calibration,float,POSTARG in axis 1 direction,PRIMARY,HST,False,"POSTARG1 indicates an offset applied to the telescope's pointing position along the first spatial axis, typically specified in arcseconds or pixels. These offsets are often used for techniques like dithering, which involves taking multiple images at slightly different positions to fill in detector gaps or improve image quality.",60,"This keyword is useful for advanced users analyzing dither patterns or requiring precise pointing information, but less critical for casual viewers.",
POSTARG2,POSTARG in axis 2 direction (sub-aperture offset),Calibration,float,POSTARG in axis 2 direction,PRIMARY,HST,False,"POSTARG2 indicates an offset applied to the telescope's pointing position along the second spatial axis, similar to POSTARG1. These offsets are crucial for understanding the exact pointing of an observation relative to a nominal target position and for combining dithered exposures.",60,"Similar to POSTARG1, this keyword is useful for advanced users involved in astrometry or dither analysis.",
CAL_VER,Calibration software version,Calibration,string,Calibration Software Version,PRIMARY,JWST; HST,False,This keyword records the specific version number of the software pipeline used to process and calibrate the astronomical data. It is important for reproducibility and understanding any potential changes or improvements in data reduction algorithms.,45,"While not essential for every user, researchers and advanced users find this useful for understanding data provenance and comparing results.",
CAL_VCS,Calibration software repository version (git hash or tag),Calibration,string,Calibration Software Repository Version,PRIMARY,JWST,False,"This keyword provides an even more precise identifier for the calibration software, often a git hash or tag from the version control system. It allows for exact reproduction of the software build used for processing.",25,"This is primarily relevant for pipeline developers or users needing extremely precise software versioning for debugging or exact reproduction, not for general users.",
CRDS_VER,Version of the CRDS client software used for reference file selection,Calibration,string,Version of CRDS file selection software used,PRIMARY,JWST,False,"This keyword specifies the version of the CRDS (Calibration Reference Data System) client software used to automatically select the appropriate calibration reference files. CRDS ensures that the correct darks, flats, and other reference data are applied during processing.",20,This information is largely internal to the data processing pipeline and holds minimal direct value for the typical end-user viewing the calibrated data.,
CRDS_CTX,Version of the CRDS context (PMAP) controlling reference file selection,Calibration,string,CRDS context (.pmap) used to select ref files,PRIMARY,JWST,False,This keyword identifies the specific 'context' or mapping file (often a PMAP file) within the CRDS system that governed the selection of calibration reference files for the observation. It dictates which versions of reference files were considered valid for the given data.,20,This keyword describes an internal aspect of the calibration system's configuration and has little direct relevance to a typical end-user.,
SDP_VER,Data processing software version,Calibration,string,Data Processing (DP) Software Version,PRIMARY,JWST,False,This keyword indicates the specific version of the scientific data processing pipeline software used to generate this data product. It is important for ensuring the reproducibility of results and understanding the exact algorithms and calibrations applied to the raw observations.,35,This keyword is primarily useful for advanced users to track data processing provenance and reproducibility.,
PRD_VER,Project Reference Database version,Calibration,string,S&OC Project Reference Database (PRD) Version,PRIMARY,JWST,False,"This keyword specifies the version of the Project Reference Database that contains crucial calibration files, instrument models, and other reference data utilized during the processing of this observation. It's vital for understanding the exact calibration context applied to the scientific data.",30,"This keyword provides context for the specific reference data used in calibration, primarily relevant for advanced users and pipeline developers.",
OSS_VER,Version number of the Observatory Scheduling Software,Calibration,string,Observatory Scheduling Software (OSS) Version,PRIMARY,JWST,False,"This keyword records the version number of the Observatory Scheduling Software used to plan and schedule the astronomical observation. While important for observatory operations, it typically does not directly influence the scientific interpretation of the resulting data for an end-user.",10,This is an internal operational detail with minimal direct relevance for astronomical data analysis by end-users.,
