keyword,description,category,datatype,comment,hdu,missions,mandatory,content,relevance_score,relevance_comment,user_comment
SIMPLE,File conforms to the FITS standard,Structural,boolean,Data conform to FITS standard,PRIMARY,FITS Standard; JWST; HST; TESS; Kepler; K2; GALEX; Spitzer; Chandra; Pan-STARRS,True,"This keyword indicates whether the FITS file strictly adheres to the basic FITS standard. A value of 'T' (True) means the file structure is standard, making it compatible with FITS-compliant software. It's a foundational check to ensure proper file parsing.",10,"This keyword is purely structural, ensuring file readability by software, with no direct information value for end-users.",
BITPIX,"Number of bits per data pixel. Allowed values: 8, 16, 32, 64 (integer), -32 (float), -64 (double).",Structural,integer,bits per data value,PRIMARY; SCI; ERR; DQ; GROUPDQ; REFOUT,FITS Standard; JWST; HST; TESS; Kepler; K2; GALEX; Spitzer; Pan-STARRS,True,"This keyword specifies the number of bits used to represent each individual pixel's data value (e.g., 16-bit integer, 32-bit floating-point). It defines the fundamental data type and precision of the raw pixel values within the image or data array. Understanding BITPIX can help users interpret the range and fidelity of the stored data.",45,"While not directly interacted with, knowing the underlying data type can be useful for advanced users interpreting data precision or performing specific analyses.",
NAXIS,Number of data array dimensions,Structural,integer,Number of axes,PRIMARY; SCI; ERR; DQ; GROUPDQ; REFOUT,FITS Standard; JWST; HST; TESS; Kepler; GALEX; Spitzer; Pan-STARRS,True,"This keyword indicates the number of dimensions in the data array, such as a 2D image (NAXIS=2) or a 3D data cube (NAXIS=3). It tells the user if they are looking at a simple image, a time series, or a more complex dataset like a spectral cube. This directly impacts how the data is visualized and explored.",75,"This keyword is important as it defines the fundamental dimensionality of the dataset, directly affecting how an app would display and allow interaction with the data.",
NAXIS1,Length of data axis 1 (columns),Structural,integer,Size of the axis,PRIMARY; SCI; ERR; DQ; GROUPDQ; REFOUT,FITS Standard; JWST; HST; TESS; Kepler; GALEX; Spitzer; Pan-STARRS,True,"This keyword specifies the size of the first dimension of the data array, which typically represents the number of columns in an image. For a 2D image, this tells you the width of the image in pixels. It's essential for understanding the spatial extent of the data.",85,"Users frequently need to know the width of an image, making this keyword highly relevant for display and spatial context.",
NAXIS2,Length of data axis 2 (rows),Structural,integer,Size of the axis,PRIMARY; SCI; ERR; DQ; GROUPDQ; REFOUT,FITS Standard; JWST; HST; TESS; Kepler; GALEX; Spitzer; Pan-STARRS,True,"This keyword specifies the size of the second dimension of the data array, which typically represents the number of rows in an image. For a 2D image, this tells you the height of the image in pixels. It's essential for understanding the spatial extent of the data.",85,"Users frequently need to know the height of an image, making this keyword highly relevant for display and spatial context.",
NAXIS3,Length of data axis 3 (planes/channels),Structural,integer,Size of the axis,PRIMARY; SCI; GROUPDQ; REFOUT,FITS Standard; JWST; HST,False,"This keyword specifies the length or size of the third dimension of the data array. For astronomical data, this often represents distinct elements like different spectral channels, multiple filters, or a time series of images, indicating that the data is a 3D cube rather than a simple 2D image.",75,"It is commonly useful for users to understand the dimensionality of data cubes, such as the number of spectral channels or filter planes, for analysis and visualization.",
NAXIS4,Length of data axis 4,Structural,integer,Size of the axis,PRIMARY; SCI; GROUPDQ; REFOUT,FITS Standard; JWST,False,"This keyword indicates the size of the fourth dimension of the data array. While less common than 2D or 3D data, a fourth axis can represent additional data aspects like polarization states, dither positions, or multiple data products within a single file.",55,"While less common than 3D data, knowing the extent of a fourth axis is useful for advanced users working with complex, higher-dimensional datasets.",
EXTEND,File may contain standard extensions,Structural,boolean,file may contain standard extensions,PRIMARY,FITS Standard; JWST; HST; TESS; Kepler; GALEX,False,"This boolean keyword, found in the primary header, indicates whether the FITS file might contain standard extensions beyond the primary data array. These extensions are separate HDUs (Header Data Units) that can hold additional data like error maps, data quality flags, or tabular information.",10,"This structural keyword informs software about the potential for extensions, but users are more interested in the content of specific extensions rather than this general flag.",
NEXTEND,Number of file extensions,Structural,integer,Number of file extensions,PRIMARY,FITS Standard; JWST; HST,False,"This keyword specifies the total number of standard FITS extensions present in the file. It provides a count of how many additional data blocks (which can be images, tables, etc.) are included alongside the primary data.",25,"While providing a count of extensions, this keyword is primarily for software parsing, and users are typically more interested in the specific types and content of individual extensions.",
PCOUNT,Number of bytes of supplemental data (parameter count),Structural,integer,number of parameter bytes following data table,SCI; ERR; DQ; GROUPDQ; REFOUT,FITS Standard; JWST; HST,True,"This keyword is used in FITS binary tables to specify the number of bytes used for supplemental data, particularly for variable-length array (VLA) columns. It points to the location where the actual variable-length data elements are stored within the data block.",5,"This keyword is purely internal and structural, used by FITS readers to correctly parse variable-length array data within tables, with no direct relevance for end-users.",
GCOUNT,Number of data groups,Structural,integer,number of groups,SCI; ERR; DQ; GROUPDQ; REFOUT,FITS Standard; JWST; HST,True,"GCOUNT specifies the number of data groups present in a variable-length array FITS file. It is primarily used for specialized FITS structures that contain multiple, often differing, data arrays within a single HDU, rather than a simple image or table.",5,This keyword is a low-level structural detail for specialized FITS files and holds almost no direct value for typical end-users.,
XTENSION,"Type of extension (IMAGE, BINTABLE, TABLE)",Structural,string,FITS extension type,SCI; ERR; DQ; GROUPDQ; REFOUT; ASDF,FITS Standard; JWST; HST,True,"XTENSION indicates the type of data stored in a FITS extension, such as an IMAGE (for images or multi-dimensional arrays), BINTABLE (for binary tables), or TABLE (for ASCII tables). This keyword helps software understand how to correctly interpret the data structure within that specific FITS High Definition Unit (HDU).",65,"While structural, XTENSION informs the user about the fundamental type of data (image vs. table) in an HDU, which impacts how they might interact with it.",
EXTNAME,Name of the extension,Structural,string,Extension name,SCI; ERR; DQ; GROUPDQ; REFOUT,FITS Standard; JWST; HST; TESS; Kepler; GALEX,False,"EXTNAME provides a descriptive name for a FITS extension, helping to identify its content and purpose within a multi-HDU FITS file. For example, it might be 'SCI' for science data, 'ERR' for error data, or 'DQ' for data quality information.",85,EXTNAME is highly useful for users to quickly identify the purpose and content of different data components within a multi-HDU FITS file.,
EXTVER,Version number of the extension,Structural,integer,Extension version number,SCI; ERR; DQ; GROUPDQ; REFOUT,FITS Standard; JWST; HST,False,"EXTVER specifies a version number for a FITS extension, which is useful when multiple extensions within the same FITS file share the same EXTNAME. This allows for distinguishing between different versions or instances of a particular data type, like 'SCI, EXTVER=1' and 'SCI, EXTVER=2'.",60,"EXTVER is useful for distinguishing between multiple instances or versions of similarly named data extensions, particularly in complex multi-HDU files.",
EXTLEVEL,Hierarchical level of the extension,Structural,integer,Hierarchical level of the extension,SCI,FITS Standard,False,"EXTLEVEL indicates the hierarchical level of a FITS extension, primarily used in more complex FITS structures where data might be nested or organized in a tree-like fashion. It helps define the relationship between extensions within a multi-HDU FITS file.",15,EXTLEVEL is a highly technical structural keyword for complex FITS hierarchies and has minimal direct relevance for typical end-users.,
BSCALE,Linear scaling factor for data values: physical = BZERO + BSCALE × array_value,Data Scaling,float,scale factor for array value to physical value,SCI; REFOUT,FITS Standard; JWST; HST; TESS; Pan-STARRS,False,"This keyword specifies the linear scaling factor used to convert raw, stored pixel values into meaningful physical units. The actual physical value of a pixel is calculated as (BZERO + BSCALE × array_value). It is crucial for converting arbitrary digital numbers into scientifically interpretable quantities like flux or intensity.",85,"It's essential for converting raw pixel counts into meaningful physical units, which is key for quantitative analysis and accurate data display.",
BZERO,Zero point offset for data values: physical = BZERO + BSCALE × array_value,Data Scaling,float,physical value for an array value of zero,SCI; REFOUT,FITS Standard; JWST; HST; TESS; Pan-STARRS,False,"This keyword represents the zero-point offset applied when converting raw, stored pixel values into physical units. The formula for conversion is (BZERO + BSCALE × array_value), meaning BZERO shifts the entire scale. It works in conjunction with BSCALE to ensure pixel values reflect true physical quantities.",85,"It works with BSCALE to convert raw pixel values into meaningful physical units, critical for quantitative analysis and accurate data representation.",
BUNIT,"Physical unit of the data array values (e.g., DN, MJy/sr, electrons/s)",Data Scaling,string,physical units of the data array values,SCI,FITS Standard; JWST; HST; TESS; Kepler; Spitzer,False,"This keyword specifies the physical units of the data array values after they have been scaled by BSCALE and BZERO. Examples include 'Jy/pixel' for flux density, 'MJy/sr' for surface brightness, or 'electrons/s' for count rates. It is absolutely fundamental for understanding what the numbers in the image or table actually represent.",95,"This keyword directly tells users the physical units of the data, which is fundamental for understanding and interpreting any quantitative measurement.",
BTYPE,"Type of data (e.g., surface brightness, flux)",Data Scaling,string,Type of data,SCI,FITS Standard; JWST,False,"This keyword provides a high-level description of the type of data contained within the array, such as 'FLUX', 'SURFACE BRIGHTNESS', 'ERROR', or 'DQ' (Data Quality). It helps users quickly understand the nature and purpose of the data, offering context beyond just the units.",80,"It helps users understand the specific nature or type of data contained in the array, providing crucial context for interpretation.",
BLANK,Value representing undefined pixels in integer arrays,Data Scaling,integer,Value representing undefined pixels,PRIMARY; SCI,FITS Standard,False,"For FITS files storing integer data, this keyword specifies a particular integer value that should be interpreted as 'no data,' 'undefined,' or 'missing.' Pixels with this value are typically ignored in calculations or rendered distinctly in visualizations, preventing erroneous analysis of invalid regions.",75,"It identifies undefined or invalid pixel values, which is important for accurate data visualization and preventing incorrect analysis of missing information.",
DATAMAX,Maximum data value in the array,Data Scaling,float,Maximum data value,PRIMARY; SCI,FITS Standard; HST; Pan-STARRS,False,"This keyword stores the maximum pixel value found within the image data array. It's important for understanding the range of brightness in an image, helping users set appropriate display scales to visualize features, and quickly identify potentially saturated regions.",75,This value is commonly useful for setting display ranges and quickly assessing data quality or dynamic range.,
DATAMIN,Minimum data value in the array,Data Scaling,float,Minimum data value,PRIMARY; SCI,FITS Standard; HST; Pan-STARRS,False,"This keyword stores the minimum pixel value found within the image data array. It helps users understand the lowest brightness levels in an image, useful for setting display scales, identifying background levels, or assessing noise characteristics.",75,This value is commonly useful for setting display ranges and quickly assessing data quality or background levels.,
DATE,File creation date in UTC (YYYY-MM-DDThh:mm:ss format),Time,string,UTC date file created,PRIMARY,FITS Standard; JWST; HST; TESS; Kepler; GALEX; Spitzer; Pan-STARRS,False,"This keyword indicates the UTC date and time when the FITS file itself was created. It's a file system timestamp rather than an observation time, useful for tracking data provenance and understanding when a particular data product was generated or last processed.",50,"This keyword is moderately useful for data management and provenance tracking, but not directly tied to the astronomical observation itself.",
DATE-OBS,Date of observation start (UTC) in YYYY-MM-DD or YYYY-MM-DDThh:mm:ss format,Time,string,UTC date at start of exposure,PRIMARY,FITS Standard; JWST; HST; TESS; Kepler; K2; GALEX; Spitzer; Chandra; Pan-STARRS; SwiftUVOT; XMM-OM,False,"This keyword records the UTC date and time when the astronomical observation actually began. It is a fundamental piece of information for any astronomical data, allowing users to know exactly when the celestial event was captured and enabling time-domain studies.",95,This is an essential piece of metadata for understanding when the astronomical observation occurred.,
DATE-BEG,Date-time of observation start (ISO 8601 format),Time,string,Date-time start of exposure,PRIMARY,FITS Standard; JWST; TESS,False,"Similar to DATE-OBS, this keyword specifies the UTC date and time of the observation's beginning, often in a standardized ISO 8601 format. It is crucial for precise timing analyses, correlating observations with other datasets, and placing the observation in its temporal context.",95,"This is an essential piece of metadata for understanding when the astronomical observation occurred, especially with its precise time component.",
DATE-END,Date-time of observation end (ISO 8601 format),Time,string,Date-time end of exposure,PRIMARY,FITS Standard; JWST; TESS; HST,False,"This keyword specifies the exact date and time when the observation concluded, formatted according to the ISO 8601 standard. It's crucial for understanding the total duration of an exposure and for precise scheduling or time-series analysis when combined with the start time.",85,"It is very useful for precise timing, calculating exposure duration, and understanding the full observational window for analysis.",
TIME-OBS,Time of observation start (UTC) in hh:mm:ss format,Time,string,UTC time at start of exposure,PRIMARY,FITS Standard; JWST; HST; GALEX; Pan-STARRS,False,"This keyword indicates the precise Universal Coordinated Time (UTC) when the astronomical observation officially began, typically in a hh:mm:ss format. It's fundamental for time-stamping data, correlating observations with events, and determining sidereal time at the start of the exposure.",95,This keyword is essential for all users to understand the precise start time of the observation.,
TIMESYS,"Principal time system for time-related keywords (e.g., UTC, TDB, TT)",Time,string,principal time system for time-related keywords,PRIMARY,FITS Standard; JWST; HST; TESS; Kepler,False,"This keyword specifies the particular time scale system used for other time-related keywords in the FITS header, such as UTC (Coordinated Universal Time) or TDB (Barycentric Dynamical Time). It's vital for ensuring accurate conversions and comparisons of timing information across different datasets or astronomical calculations.",75,This keyword is important for advanced users who need to perform precise time conversions or compare datasets with different time systems.,
TIMEUNIT,"Default unit for time values (e.g., 's' for seconds, 'd' for days)",Time,string,Default unit applicable to all time values,PRIMARY,FITS Standard; JWST,False,"This keyword defines the standard unit of measure for any numerical time values present in the FITS header that don't explicitly specify their own units, such as 's' for seconds or 'd' for days. It ensures unambiguous interpretation of time-related data.",70,This keyword is important for correctly interpreting numerical time values and ensuring proper display or calculation of durations.,
MJD-OBS,Modified Julian Date of observation start,Time,float,Modified Julian Date of observation start,PRIMARY,FITS Standard; JWST; HST; TESS; Pan-STARRS,False,"This keyword provides the Modified Julian Date (MJD) corresponding to the start of the observation, expressed as a floating-point number. MJD is a widely used astronomical time system that simplifies calculations by counting days continuously from a specific epoch, making it ideal for precise timing and long-term event tracking.",90,"This keyword is highly relevant for precise astronomical timing, calculations, and comparing observation epochs across different datasets.",
MJD-BEG,Modified Julian Date of exposure start,Time,float,[d] exposure start time in MJD,SCI,FITS Standard; JWST; TESS,False,"This keyword specifies the exact Modified Julian Date (MJD) when an astronomical observation began. It's crucial for precisely timing events, correlating observations with other data, and accounting for celestial motion or instrumental changes over time.",95,"Users often need the precise start time of an observation for analysis, correlation, and historical context.",
MJD-MID,Modified Julian Date of exposure midpoint,Time,float,Modified Julian Date of exposure midpoint,PRIMARY,JWST,False,"This keyword gives the Modified Julian Date (MJD) corresponding to the exact midpoint of an astronomical exposure. It's often considered the most representative time for the observation, particularly for objects with changing positions or fluxes.",98,"The midpoint time is frequently the most representative time for an observation, essential for many astronomical analyses.",
MJD-AVG,Modified Julian Date of exposure midpoint (average),Time,float,[d] exposure mid-point in MJD,SCI,FITS Standard; JWST,False,"Similar to MJD-MID, this keyword represents the average or midpoint Modified Julian Date (MJD) of an exposure or data collection period. It provides a single representative timestamp for the observation, important for linking data to ephemerides or other time-variable phenomena.",97,"This keyword provides a key representative timestamp for the observation, crucial for time-sensitive analysis.",
MJD-END,Modified Julian Date of exposure end,Time,float,[d] exposure end time in MJD,SCI,FITS Standard; JWST; TESS,False,This keyword indicates the Modified Julian Date (MJD) at which an astronomical observation concluded. It's important for calculating the total duration of an exposure and for understanding the temporal boundaries of the collected data.,94,The end time of an observation is vital for understanding the observation's duration and its temporal context.,
EXPSTART,Exposure start time in Modified Julian Date,Exposure,float,[d] exposure start time in MJD,PRIMARY,JWST; HST,False,"This keyword provides the start time of the exposure in Modified Julian Date (MJD). It's a fundamental timestamp indicating when data collection began, essential for understanding the temporal context of an observation and for precise astrometric or photometric analysis.",96,Users need the precise start time of an observation to understand its temporal context and for accurate data analysis.,
EXPMID,Exposure mid time in Modified Julian Date,Exposure,float,[d] exposure mid time in MJD,PRIMARY,JWST; HST,False,"This keyword indicates the exact midpoint of the observation's exposure, expressed as a Modified Julian Date (MJD). It's crucial for time-sensitive analyses, such as tracking variable stars, analyzing transient events, or aligning observations with precise ephemeris data. Knowing the precise middle of the exposure provides the most accurate timestamp for the collected photons.",85,"Provides a precise timestamp for the observation, critical for time-domain astronomy or linking to ephemeris data.",
EXPEND,Exposure end time in Modified Julian Date,Exposure,float,[d] exposure end time in MJD,PRIMARY,JWST; HST,False,"This keyword specifies the exact moment the observation concluded, expressed as a Modified Julian Date (MJD). While EXPMID gives the center point, EXPEND is vital for understanding the full duration of an event, coordinating follow-up observations, or precisely marking the end of data collection in time-sensitive studies. It complements EXPMID and EXPTIME to fully define the observation's temporal bounds.",80,"Pinpoints the conclusion of the observation, useful for precise event timing and coordinating subsequent data.",
EXPTIME,Exposure time in seconds,Exposure,float,[s] Exposure time,PRIMARY,FITS Standard; JWST; HST; TESS; Kepler; K2; GALEX; Spitzer; Chandra; Pan-STARRS; SwiftUVOT; XMM-OM,False,"This is a fundamental keyword indicating the total duration, in seconds, that the detector was open and collecting light from the astronomical source. It directly impacts the signal-to-noise ratio and the overall brightness of the captured image, making it essential for understanding the quality and depth of the observation. A longer exposure generally means more light collected and a clearer image.",98,"A fundamental parameter that directly indicates how long light was collected, crucial for understanding signal strength and data quality.",
EFFEXPTM,Effective exposure time corrected for dead time (seconds),Exposure,float,[s] Effective exposure time,PRIMARY,JWST,False,"This keyword represents the 'effective' exposure time, corrected for any periods where the detector was not actively collecting useful photons, known as 'dead time.' This can include time spent on readout, shutter operations, or other instrument overheads. It provides a more accurate measure of the true integration duration for scientific analysis, particularly for precise photometry and flux calculations.",75,"Provides a more accurate exposure duration by accounting for periods of detector inactivity, important for precise scientific measurements.",
EFFINTTM,Effective integration time (seconds),Exposure,float,[s] Effective integration time,PRIMARY,JWST,False,"This keyword specifies the effective integration time, which is the total time the detector was actively accumulating photons, often accounting for instrument-specific readout patterns or multiple non-destructive reads within an exposure. It's particularly relevant for instruments with complex observing strategies, like JWST, to provide a precise measure of the actual photon collection duration, which can differ from the raw exposure time.",60,"A specialized measure of actual photon collection time, particularly useful for understanding complex instrument readout modes like those on JWST.",
DURATION,Total duration of exposure: integration time × number of integrations (seconds),Exposure,float,[s] Total duration of exposure,PRIMARY,JWST,False,"This keyword indicates the total time the detector was actively collecting light, calculated as the product of the integration time for a single readout and the total number of such integrations. It represents the overall light-gathering duration for the observation, ignoring overheads. This is a fundamental measure of the exposure's depth.",95,Users frequently check this value to understand how much light was collected for the observation and its overall depth.,
XPOSURE,Effective exposure time in seconds (in SCI extension),Exposure,float,[s] Effective exposure time,SCI,JWST,False,"This keyword provides the effective exposure time in seconds, typically after accounting for any periods where the detector was not actively collecting usable photons (e.g., due to detector resets or non-science frames). It's a refined and often more accurate measure of the actual science exposure duration.",98,"This value provides the most accurate measure of the effective integration time for the science data, which is crucial for analysis.",
TELAPSE,Total elapsed exposure time in seconds,Exposure,float,[s] Total elapsed exposure time,SCI,JWST,False,"This keyword records the total wall-clock time that elapsed during the entire exposure, from the start of the first integration to the end of the last. It includes not only the photon collection time but also any overheads between integrations or readouts, providing insight into the total observation duration.",75,"While useful for understanding observation overheads and scheduling, it's less critical for interpreting the direct science content of an individual image compared to effective exposure time.",
